{
  "$schema": "../schema/lesson.schema.json",
  "formatVersion": "1.5",
  "id": "the-battle-of-vicksburg",
  "contentVersion": "0.5.0",
  "status": "draft",
  "updated": "2026-10-21",
  "reviewed": null,
  "title": "The Battle of Vicksburg",
  "sheetTitle": {
    "es": "La batalla de Vicksburg"
  },
  "summary": "Follow Grant's 1863 march to Vicksburg along the Mississippi River, and see why taking the city split the Confederacy in two.",
  "subject": "History",
  "course": "US History",
  "unit": "The Civil War",
  "grade": "8",
  "subjects": [
    "US History",
    "Geography",
    "Social Studies"
  ],
  "time": "45 minutes, or 10–15 per question",
  "studentLogin": "Not needed to explore the map",
  "map": {
    "webmapId": "1ba8cd3fc75a49a497be1137fce4c032",
    "bookmarks": [
      "The Battle of Vicksburg"
    ],
    "layers": [
      {
        "name": "Key Places in the Union March to Vicksburg",
        "shows": "Places on Grant's route in spring 1863, as dark pins labeled on the map: Miliken's Bend, New Carthage, Hard Times, Bruinsburg Bend and Edwards, plus a yellow pin at Vicksburg. No pop-ups.",
        "source": "Placed by the MapMaker team"
      },
      {
        "name": "Railroads 1826 to 1911",
        "shows": "Railroads built from 1826 to 1911, so it includes lines built after the war. They only draw when zoomed in. No pop-up.",
        "source": "Jeremy Atack, historical railroad data (ICPSR 36353), prepared by the MapMaker team"
      },
      {
        "name": "Civil War Battlefields",
        "shows": "Civil War battles as diamonds colored by result. Each pop-up gives the battle's name and dates and a picture; it does not give the result.",
        "source": "American Battlefield Trust",
        "offAtStart": true
      }
    ]
  },
  "knownIssues": [
    {
      "where": "Key Places in the Union March to Vicksburg",
      "note": "The label \"Miliken's Bend\" is usually spelled Milliken's Bend, and the point at Vicksburg itself is titled \"Point\".",
      "status": "open",
      "date": "2026-10-12"
    },
    {
      "where": "Civil War Battlefields",
      "note": "Port Gibson appears twice in the layer (two identical features at the same spot), so its pop-up says 1 of 2.",
      "status": "open",
      "date": "2026-10-15"
    }
  ],
  "inquiry": {
    "compellingQuestion": {
      "en": "Why did the Union need Vicksburg, and how did Grant take it?",
      "es": "¿Por qué necesitaba la Unión a Vicksburg y cómo la tomó Grant?"
    },
    "questions": [
      {
        "id": "q1",
        "title": {
          "en": "Why Vicksburg?",
          "es": "¿Por qué Vicksburg?"
        },
        "task": "Open The Battle of Vicksburg bookmark. Vicksburg is the yellow pin. Look at where it sits on the Mississippi River. Zoom in until the railroads draw and follow the line east from Vicksburg to Jackson, Mississippi, the state capital, which is a basemap label (not a pin). Why would both sides want the city?",
        "tools": [
          "bookmarks",
          "zoom"
        ],
        "core": false,
        "minutes": 10,
        "frontOfClass": [
          "Open The Battle of Vicksburg bookmark.",
          "Point to the yellow pin at Vicksburg on the bend of the Mississippi River.",
          "Zoom in until the railroad line draws.",
          "Follow the railroad east from Vicksburg to the Jackson label on the basemap.",
          "Ask: why would both sides want Vicksburg?"
        ],
        "student": {
          "en": "Open The Battle of Vicksburg bookmark. Vicksburg is the yellow pin on the Mississippi River. Zoom in until the railroads appear and follow the line east from Vicksburg. Find Jackson, Mississippi, on the basemap (the state capital, east of Vicksburg). Why would both sides want Vicksburg?",
          "es": "Abre el marcador The Battle of Vicksburg (la batalla de Vicksburg). Vicksburg es el alfiler amarillo junto al río Misisipi. Acércate hasta que aparezcan los ferrocarriles y sigue la línea hacia el este desde Vicksburg. Busca Jackson, Misisipi, en el mapa base (la capital del estado, al este de Vicksburg). ¿Por qué querrían Vicksburg ambos lados?"
        },
        "answer": {
          "where": "The Battle of Vicksburg bookmark; yellow pin at Vicksburg on a bend of the Mississippi; Railroads 1826 to 1911 layer, which draws when zoomed in to about 1:1,500,000 or closer; Jackson is a label on the Modern Antique basemap about 40 miles east.",
          "accept": "A good answer says Vicksburg sits on the river, so whoever held it controlled traffic on the Mississippi, and that its railroad linked the river to Jackson and the rest of the Confederacy, so it was both a river stronghold and a rail junction. Mentioning the bluffs or guns is extra, not on the map."
        }
      },
      {
        "id": "q2",
        "title": {
          "en": "Grant's route",
          "es": "La ruta de Grant"
        },
        "task": "Find the dark pins and put them in order along Grant's route: Milliken's Bend, New Carthage, Hard Times, Bruinsburg Bend, then Edwards. Which side of the river is each on? Measure the straight-line distance from Milliken's Bend to Bruinsburg Bend.",
        "tools": [
          "zoom",
          "measure"
        ],
        "core": true,
        "minutes": 15,
        "frontOfClass": [
          "Open The Battle of Vicksburg bookmark.",
          "Point to the dark pins in order: Milliken's Bend, New Carthage, Hard Times, Bruinsburg Bend, then Edwards.",
          "Ask: which side of the river is each pin on?",
          "Use Measure from Milliken's Bend to Bruinsburg Bend.",
          "Ask: why did Grant march south down the far bank before crossing?"
        ],
        "student": {
          "en": "Find the dark pins for Milliken's Bend, New Carthage, Hard Times, Bruinsburg Bend and Edwards. Which side of the river is each on? Why did Grant march south before crossing the river?",
          "es": "Busca los alfileres oscuros de Milliken's Bend, New Carthage, Hard Times, Bruinsburg Bend y Edwards. ¿De qué lado del río está cada lugar? ¿Por qué marchó Grant hacia el sur antes de cruzar el río?"
        },
        "fill": {
          "en": "Measure the distance from Milliken's Bend to Bruinsburg Bend: ________ miles",
          "es": "Mide la distancia de Milliken's Bend a Bruinsburg Bend: ________ millas"
        },
        "answer": {
          "where": "Key Places in the Union March to Vicksburg pins, read against the river and the basemap state labels: Milliken's Bend, New Carthage and Hard Times are on the west (Louisiana) bank; Bruinsburg Bend and Edwards are on the east (Mississippi) side. Measure tool, Milliken's Bend pin to Bruinsburg Bend pin: about 33 miles in a straight line (accept 31 to 36).",
          "accept": "A good answer notices that Vicksburg's pin sits on the river between Milliken's Bend (north) and Bruinsburg Bend (south), so Grant could not cross right at the city; he marched down the far bank, out of reach of the city, crossed well to the south, then turned back toward Vicksburg from the east (Edwards)."
        }
      },
      {
        "id": "q3",
        "title": {
          "en": "The battles of May 1863",
          "es": "Las batallas de mayo de 1863"
        },
        "task": "Turn on Civil War Battlefields in Map layers and click the diamonds between Bruinsburg Bend and Vicksburg, and east toward Jackson. Put the battles in order by date from the pop-ups.",
        "tools": [
          "layers",
          "popups",
          "zoom"
        ],
        "core": false,
        "minutes": 12,
        "frontOfClass": [
          "In Map layers, turn on Civil War Battlefields.",
          "Click the diamond at Port Gibson, near Bruinsburg Bend, and read its date (use the arrows if it says 1 of 2).",
          "Click the diamonds east toward Jackson, reading each date: Raymond, Jackson, Champion Hill, Big Black River Bridge.",
          "Click the Vicksburg diamond and read its two dates.",
          "Ask: in what order were the battles fought, and which way did Grant's army move?"
        ],
        "student": {
          "en": "In Map layers, turn on Civil War Battlefields. Click the diamonds between Bruinsburg Bend and Vicksburg, and east toward Jackson, and list the battles in order by date.",
          "es": "En las capas del mapa (Map layers), activa Civil War Battlefields (campos de batalla de la Guerra Civil). Haz clic en los rombos entre Bruinsburg Bend y Vicksburg, y hacia el este en dirección a Jackson, y ordena las batallas por fecha."
        },
        "lines": 5,
        "answer": {
          "where": "Civil War Battlefields pop-ups: the name is in bold and the dates below it. Port Gibson's pop-up says 1 of 2; both entries are the same battle. Grand Gulf (April 29, 1863), on the river just north of Bruinsburg, is the Union navy's failed attack before the crossing; accept it if students include it.",
          "table": {
            "caption": "Battles of Grant's Vicksburg campaign, from the pop-ups",
            "columns": [
              "Battle",
              "Dates"
            ],
            "rows": [
              [
                "Port Gibson",
                "May 1, 1863"
              ],
              [
                "Raymond",
                "May 12, 1863"
              ],
              [
                "Jackson, Mississippi",
                "May 14, 1863"
              ],
              [
                "Champion Hill",
                "May 16, 1863"
              ],
              [
                "Big Black River Bridge",
                "May 17, 1863"
              ],
              [
                "Vicksburg",
                "May 18, 1863 – July 4, 1863"
              ]
            ]
          }
        }
      },
      {
        "id": "q4",
        "title": {
          "en": "Splitting the Confederacy",
          "es": "La Confederación partida en dos"
        },